Drug_Name_CDSCO,Drug_Name_FDA,Indication_CDSCO,Indication_FDA,CDSCO_Approval_Date,FDA_Marketing_Approval_Date,Match_Score,FDA_Generic_Name,FDA_Trade_Name,FDA_Sponsor_Company,FDA_Sponsor_State,FDA_Sponsor_Country
calcium + magnesium,Calcium acetate,"For the treatment of milk fever, hypocalcaemia tetanies and disorders of calcium metabolism in dairy cattle.",,09/16/2008,12/10/1990,100.0,Calcium acetate,Phos-Lo,Fresenius Medical Care North America,Massachusetts,United States
tadalafil,tadalafil,For the treatment of pulmonary arterial hypertension.,Treatment of pulmonary arterial hypertension (WHO Group I) to improve exercise ability,11/14/2009,05/22/2009,100.0,tadalafil,Adcirca,Eli Lilly and Company,Indiana,United States
vemurafenib,vemurafenib,For the treatment of patients with unresectable or metastatic melanoma with BRAFV600E mutation as detected by an FDA-approved test. Vemurafenib is not recommended for use in patients with wild-type BRAF melanoma.,Treatment of unresectable or metastatic melanoma with the BRAFV600E mutation as detected by an FDA-approved test.,10/19/2012,08/17/2011,100.0,vemurafenib,Zelboraf,"Hoffmann-La Roche, Inc.",New Jersey,United States
ambrisentan,ambrisentan,For the treatment of pulmonary arterial hypertension (WHO Group I) in patients with WHO class II or III symptoms to improve exercise capacity and delay clinical worsening.,Treatment of pulmonary arterial hypertension (WHO group I) in patients with WHO class II or III symptoms to improve exercise capacity and delay clinical worsening,05/28/2010,06/15/2007,100.0,ambrisentan,Letairis,Gilead Colorado,Colorado,United States
mesna,Mesna,Urotoxic agent- for prevention of urotoxic side effects associated with the treatment of malignant tumours by oxazaphosphorines.,,01/12/1981,12/30/1988,100.0,Mesna,Mesnex,Degussa Corporation,New Jersey,United States
fenfluramine hydrochloride,fenfluramine,,Treatment of seizures associated with Lennox-Gastaut syndrome (LGS) in patients 2 years of age and older,09/07/1993,03/25/2022,100.0,fenfluramine,Fintepla,"UCB, Inc.",Georgia,United States
leuprolide acetate,Leuprolide acetate,For children in central precocious puberty.,treatment of pediatric patients with central precocious puberty (CPP),10/08/2006,04/14/2023,100.0,Leuprolide acetate,Lupron Depot-Ped,AbbVie Endocrine Inc.,Illinois,United States
selegiline hydrochloride,Selegiline HCl,Parkinsonism- Indicated in the treatment of Parkinson's disease.,,01/08/1991,06/05/1989,100.0,Selegiline HCl,Eldepryl,"Somerset Pharmaceuticals, Inc.",New Jersey,United States
pyrazinamide,Rifater,Anti-tuberculosis.,Short-course treatment of tuberculosis.,01/09/2064,05/31/1994,100.0,"Rifampin, isoniazid, pyrazinamide",Rifater,Hoechst Marion Roussel,Missouri,United States
midodrine hydrochloride,Midodrine HCl,For the treatment of symptomatic orthostatic hypotension.,Treatment of symptomatic orthostatic hypotension.,02/09/2016,09/06/1996,100.0,Midodrine HCl,Amatine,"Takeda Development Center Americas, Inc.",Massachusetts,United States
octreotide,Octreotide,,Supression of severe diarrhea and flushing associated with malignant carcinoid syndrome.,01/08/2005,11/25/1998,100.0,Octreotide,Sandostatin LAR,Novartis Pharmaceuticals Corporation,New Jersey,United States
teriparatide,Teriparatide,For osteoporosis.,,03/26/2008,12/23/1987,100.0,Teriparatide,Parathar,"Rhone-Poulenc Rorer Pharmaceuticals, Inc.",Pennsylvania,United States
